 ,No-brainer keywords,Keywords as separate words (simulated in tool),Negative keywords,Keyword research status,Status,Headline,Icon Pages,Link pointing to,Cilckable link,Bottom-text,Icon page created?,Text in plugin,,Comments
"(General, if we don't find a topic for the site)",-,-,-,(Done),Integrated in plugin?,New feature: Tailored icons,,https://www.ultimatelysocial.com/themed-icons/?utm_source=any_settings_page&utm_campaign=Themed_icons&utm_medium=banner,https://www.ultimatelysocial.com/themed-icons/?utm_source=any_settings_page&utm_campaign=Themed_icons&utm_medium=banner,See more themed icons >,yes,,,
Cat,"cattery, catrescue, rescuedcat, kitten, kitty, meow, feline","cat, cats","Catherine,catwalk,",Done,Integrated in plugin?,Do you like cats?,https://www.ultimatelysocial.com/cat-themed-icons/,https://www.ultimatelysocial.com/Cat-themed-icons/?utm_source=any_settings_page&utm_campaign=Cat_icons&utm_medium=banner,https://www.ultimatelysocial.com/Cat-themed-icons/?utm_source=any_settings_page&utm_campaign=Cat_icons&utm_medium=banner,See all cat-themed-icons >,yes,,,
Horse,"equine, gallop","horse, horses, pony, ponies","horseengine, seahorses, seahorse, seapony, seaponies, horseengines, ponytail",Done,Integrated in plugin?,Do you like horses?,https://www.ultimatelysocial.com/horse-themed-icons/,https://www.ultimatelysocial.com/Horse-themed-icons/?utm_source=any_settings_page&utm_campaign=Horse_icons&utm_medium=banner,https://www.ultimatelysocial.com/Horse-themed-icons/?utm_source=any_settings_page&utm_campaign=Horse_icons&utm_medium=banner,See all horse-themed-icons >,yes,,,
Teeth,"dentist, teeth, dental",tooth,"bluetooth, gadgetooth",Done,Integrated in plugin?,You got a thing with teeth?,https://www.ultimatelysocial.com/teeth-themed-icons/,https://www.ultimatelysocial.com/Teeth-shaped-icons/?utm_source=any_settings_page&utm_campaign=Teeth_icons&utm_medium=banner,https://www.ultimatelysocial.com/Teeth-shaped-icons/?utm_source=any_settings_page&utm_campaign=Teeth_icons&utm_medium=banner,See all teeth-themed-icons >,yes,,,for dentists
Beer,"beer, brewery, oktoberfest, barley, beerfest, brewers, brewer","brew, stout, malt, brews, stouts, malts","hebrew, malta",Done,Integrated in plugin?,Do you like beer?,https://www.ultimatelysocial.com/beer-themed-icons/,https://www.ultimatelysocial.com/Beer-themed-icons/?utm_source=any_settings_page&utm_campaign=Beer_icons&utm_medium=banner,https://www.ultimatelysocial.com/Beer-themed-icons/?utm_source=any_settings_page&utm_campaign=Beer_icons&utm_medium=banner,See all beer-themed-icons >,yes,,,
Photography,"photography, snapshot, fotografia","camera, photo, snap, cameras, photos, snaps, foto, ","cameracivile, cameradelcommercio, snapdragon, snappy",Done,Integrated in plugin?,Do you like photography?,https://www.ultimatelysocial.com/photography-themed-icons/,https://www.ultimatelysocial.com/Photography-themed-icons/?utm_source=any_settings_page&utm_campaign=Photography_icons&utm_medium=banner,https://www.ultimatelysocial.com/Photography-themed-icons/?utm_source=any_settings_page&utm_campaign=Photography_icons&utm_medium=banner,See all photography-themed-icons >,yes (to be completed),,,
Realestate,"realestate, realtor, property, immoveables, accomodation","housing,housings, houses, house, casa",bakehouse,Done,Integrated in plugin?,Are you into real estate?,https://www.ultimatelysocial.com/realestate-themed-icons/,https://www.ultimatelysocial.com/Realestate-themed-icons/?utm_source=any_settings_page&utm_campaign=Realestate_icons&utm_medium=banner,https://www.ultimatelysocial.com/Realestate-themed-icons/?utm_source=any_settings_page&utm_campaign=Realestate_icons&utm_medium=banner,See all real-estate-themed-icons >,yes (to be completed),,,
Cooking,"cooking, recipe, chef, baking, roasting, grilling, frying, resto, restaurant, culinary, culinaria, salad, kitchen","cook, bake, grill, fry, cooks, bakes, grills, frys, dine","grillo, grilla, noureddine",Done,Integrated in plugin?,Do you like cooking?,https://www.ultimatelysocial.com/cooking-themed-icons/,https://www.ultimatelysocial.com/Cooking-themed-icons/?utm_source=any_settings_page&utm_campaign=Cooking_icons&utm_medium=banner,https://www.ultimatelysocial.com/Cooking-themed-icons/?utm_source=any_settings_page&utm_campaign=Cooking_icons&utm_medium=banner,See all cooking-themed-icons >,yes (to be completed),,,
Drinking,"drinking, wine, winery, softdrinks, booze, guzzle","drunk, drink, drunks, drinks",,Done,Integrated in plugin?,Do you like drinks?,https://www.ultimatelysocial.com/drinking-themed-icons/,https://www.ultimatelysocial.com/Drinking-themed-icons/?utm_source=any_settings_page&utm_campaign=Drinking_icons&utm_medium=banner,https://www.ultimatelysocial.com/Drinking-themed-icons/?utm_source=any_settings_page&utm_campaign=Drinking_icons&utm_medium=banner,See all drinking-themed-icons >,yes (to be completed),,,
Travel,"travel, journey, trekking, voyage, traveler, tourist, tourism, maps, yacht","trek, trip, treks, trips, hike, hiking, tour, tours","startrek, trekstar, strip, stripper, trippy, stripping, tripwire",Done,Integrated in plugin?,Are you a traveler?,https://www.ultimatelysocial.com/travel-themed-icons/,https://www.ultimatelysocial.com/Travel-themed-icons/?utm_source=any_settings_page&utm_campaign=Travel_icons&utm_medium=banner,https://www.ultimatelysocial.com/Travel-themed-icons/?utm_source=any_settings_page&utm_campaign=Travel_icons&utm_medium=banner,See all travel-themed-icons >,yes (to be completed),,,
Music,"music, sound, rhythm, guitar, singing, audio, piano, violin, podcast","drums, cello, celloes, song, songs","eardrums, balisong, thaisong",Done,Integrated in plugin?,Do you like music?,https://www.ultimatelysocial.com/music-themed-icons/,https://www.ultimatelysocial.com/Music-themed-icons/?utm_source=any_settings_page&utm_campaign=Music_icons&utm_medium=banner,https://www.ultimatelysocial.com/Music-themed-icons/?utm_source=any_settings_page&utm_campaign=Music_icons&utm_medium=banner,See all music-themed-icons >,yes (to be completed),,,
Dogs,"puppy, pups, puppies, pooch, puppies","pup, dog, dogs","puppet, puppets, dogana",Done,Please integrate into plugin,Do you like dogs?,https://www.ultimatelysocial.com/dogs-themed-icons/,https://www.ultimatelysocial.com/Dogs-themed-icons/?utm_source=any_settings_page&utm_campaign=Dogs_icons&utm_medium=banner,https://www.ultimatelysocial.com/Dogs-themed-icons/?utm_source=any_settings_page&utm_campaign=Dogs_icons&utm_medium=banner,See all dogs-themed-icons >,,,,
Love,"dating, cupid, relationship, relationships, couples","heart, romance",,Done,Please integrate into plugin,Are you a loving person?,https://www.ultimatelysocial.com/love-themed-icons/,https://www.ultimatelysocial.com/Love-themed-icons/?utm_source=any_settings_page&utm_campaign=Love_icons&utm_medium=banner,https://www.ultimatelysocial.com/Love-themed-icons/?utm_source=any_settings_page&utm_campaign=Love_icons&utm_medium=banner,See all love-themed-icons >,,,,
,,,,,,,,,,,,,,
,,,,,,,,,,,,,,
Naturegardening,"environment, flora, flower, flowers, gardening, botany, sapling, saplings, greenpeace, fleurs, fleur","forest, forests, tree, trees, nature, garden","forestcity, gardenia",Done,Please integrate into plugin,Is your site about nature / gardening?,https://www.ultimatelysocial.com/naturegardening-themed-icons/,https://www.ultimatelysocial.com/Naturegardening-themed-icons/?utm_source=any_settings_page&utm_campaign=Naturegardening_icons&utm_medium=banner,https://www.ultimatelysocial.com/Naturegardening-themed-icons/?utm_source=any_settings_page&utm_campaign=Naturegardening_icons&utm_medium=banner,See all nature-themed-icons >,,,,
,,,,,,,,,,,,,,
,,,,,,,,,,,,,,
finance,"investing, finance, invest, money, business, entrepreneur, marketing, accounting, accountant, trading, taxes, marketing, branding","bank, banks. loan, loans, seo, tax","foodbank, riverbanks, riverbank, taxi, taxis",Done,Please integrate into plugin,Is your site about money?,https://www.ultimatelysocial.com/finance-themed-icons/,https://www.ultimatelysocial.com/finance-themed-icons/?utm_source=any_settings_page&utm_campaign=finance_icons&utm_medium=banner,https://www.ultimatelysocial.com/finance-themed-icons/?utm_source=any_settings_page&utm_campaign=finance_icons&utm_medium=banner,See all money-themed-icons >,,,,
Sports,"football, soccer, sport, sporting, baseball, basketball, tennis, golf, rugby, boxing, cricket, bodybuilding, fitness, workout","muscle, muscles, ski","musclecar, musclecars",Done,Please integrate into plugin,Is your site about sports?,https://www.ultimatelysocial.com/sports-themed-icons/,https://www.ultimatelysocial.com/Sports-themed-icons/?utm_source=any_settings_page&utm_campaign=Sports_icons&utm_medium=banner,https://www.ultimatelysocial.com/Sports-themed-icons/?utm_source=any_settings_page&utm_campaign=Sports_icons&utm_medium=banner,See all sports-themed-icons >,,,,
Automotives,"motorbikes, bike, truck, trucks, motors, automobile, automotive, automobiles, automotives, locomotive, locomotives, buses, trisikel, triciclo, biker, motociclismo, motociclista, motociclo, nissan, toyota, mitsubishi, suzuki,","car, cars, ride, rides, auto, trains, bus, tires, tire, sedan, SUV, wheel, wheels, wheelz, audi, ford, fiat","carmen, carlo, carlos, carmela, carla, cartoon, carpet, carson, carpentry, carpenteer, carta, madagascar, ridere, automatick, automeritum, automation, buscando, bush, busk, tired, retired, busca, sedano, wheelchair, cartwheel, cartwheels",Done,Please integrate into plugin,Is your site about automotives?,https://www.ultimatelysocial.com/automotives-themed-icons/,https://www.ultimatelysocial.com/Automotives-themed-icons/?utm_source=any_settings_page&utm_campaign=Automotives_icons&utm_medium=banner,https://www.ultimatelysocial.com/Automotives-themed-icons/?utm_source=any_settings_page&utm_campaign=Automotives_icons&utm_medium=banner,See all automotives-themed-icons >,,,,
Tech,"computer, hardware, gadget, gadgets, computing, software, android, Drone, Droner,","app, apps, pc, cpu, gpu, chip, chipset","appartement, applied, apprenties, apprentie, apparel, apparels, apprentice, apprentices, appointment, appointments, approach, apporoaches, apple, apples, potatochip, potatochips",Done,Please integrate into plugin,Is your site about tech?,https://www.ultimatelysocial.com/tech-themed-icons/,https://www.ultimatelysocial.com/Tech-themed-icons/?utm_source=any_settings_page&utm_campaign=Tech_icons&utm_medium=banner,https://www.ultimatelysocial.com/Tech-themed-icons/?utm_source=any_settings_page&utm_campaign=Tech_icons&utm_medium=banner,See all IT-themed-icons >,,,,e.g computer icons
Gaming,"gaming, games, playstation, xbox, nintendo, casino, poker, blackjack, gambling, ludico","ps2, ps3, ps4, ludo",,Done,Please integrate into plugin,Is your site about gaming?,https://www.ultimatelysocial.com/gaming-themed-icons/,https://www.ultimatelysocial.com/Gaming-themed-icons/?utm_source=any_settings_page&utm_campaign=Gaming_icons&utm_medium=banner,https://www.ultimatelysocial.com/Gaming-themed-icons/?utm_source=any_settings_page&utm_campaign=Gaming_icons&utm_medium=banner,See all games-themed-icons >,,,,
Literature,"literature, literatures","book, books, novel, novels, reading","booklet, booklets, facebook, ouchbook, sketchbook, sketchbooks, notebook, notebooks, bookkeeper, bookkeepers, bookeeper, bookeepers, chromebook, chromebooks, scrapbook, scrapbooks, novelty",Done,Please integrate into plugin,Are you a bookworm?,https://www.ultimatelysocial.com/literature-themed-icons/,https://www.ultimatelysocial.com/Literature-themed-icons/?utm_source=any_settings_page&utm_campaign=Literature_icons&utm_medium=banner,https://www.ultimatelysocial.com/Literature-themed-icons/?utm_source=any_settings_page&utm_campaign=Literature_icons&utm_medium=banner,See all book-themed-icons >,,,,
Religion,"jesus, buddha, church, churches, mosque, islam, muslim, quran, shinto, buddhism, buddhist, buddhists, muslims, catholic, catholics, christians, hebrew, hebrews, priest, priesthood, priests, judaism, judaists, judahist, mormon, mormons, judaica, shabbat, tanakh, torah, torahs, tanakhs, shabbats, testament, newtestament, oldtestament, ramadan, baptist, baptists","god, gods, christ, faith","godaddy, godfather, godfathers, godmother, godmothers, godmom, christmas, christabel",Done,Please integrate into plugin,Is your site about religion?,https://www.ultimatelysocial.com/religion-themed-icons/,https://www.ultimatelysocial.com/Religion-themed-icons/?utm_source=any_settings_page&utm_campaign=Religion_icons&utm_medium=banner,https://www.ultimatelysocial.com/Religion-themed-icons/?utm_source=any_settings_page&utm_campaign=Religion_icons&utm_medium=banner,See all religion-themed-icons >,,,,
Art-Design,"Artist, artists, design, designer, illustration, illustrations, crafting, artista, illustrator, creative, painting, painter, paint,","craft, crafts, crafty, printing, art, arts","minecraft, warcraft, aircraft, singcraft, witchcraft, imprinting, stuttgart, smart, heart, hearts, start, starts. smarts, martha, apartamentre. stewart, stewarts, mart, marts, dart, darts, artrite",Done,Please integrate into plugin,Is your site about art or design?,https://www.ultimatelysocial.com/art-design-themed-icons/,https://www.ultimatelysocial.com/Art-Design-themed-icons/?utm_source=any_settings_page&utm_campaign=Art-Design_icons&utm_medium=banner,https://www.ultimatelysocial.com/Art-Design-themed-icons/?utm_source=any_settings_page&utm_campaign=Art-Design_icons&utm_medium=banner,See all art/design-themed-icons >,,,,
Fashion,"fashion, fashionista, clothes, clothing, shoes, gown, gowns,dressage, makeup, apparels, apparel, leather, shirt,"," dress, dresses, wear, mode, moda","dressing, address",Done,Please integrate into plugin,Is your site about fashion?,https://www.ultimatelysocial.com/fashion-themed-icons/,https://www.ultimatelysocial.com/Fashion-themed-icons/?utm_source=any_settings_page&utm_campaign=Fashion_icons&utm_medium=banner,https://www.ultimatelysocial.com/Fashion-themed-icons/?utm_source=any_settings_page&utm_campaign=Fashion_icons&utm_medium=banner,See all beauty/fashion-themed-icons >,,,,
Health,"doctor, clinic, medicine, wellness, clinica, healthcare, dentist, dental, surgeon, surgery, pharmacy, farmacy, klinik","health, pharma",,Done,Please integrate into plugin,Is your site about health?,https://www.ultimatelysocial.com/health-themed-icons/,https://www.ultimatelysocial.com/Health-themed-icons/?utm_source=any_settings_page&utm_campaign=Health_icons&utm_medium=banner,https://www.ultimatelysocial.com/Health-themed-icons/?utm_source=any_settings_page&utm_campaign=Health_icons&utm_medium=banner,See all health-themed-icons >,,,,
Animals,"wildlife, fauna, animals,animal, zoology",,,Done,Please integrate into plugin,Do you like animals?,https://www.ultimatelysocial.com/animals-themed-icons/,https://www.ultimatelysocial.com/Animals-themed-icons/?utm_source=any_settings_page&utm_campaign=Animals_icons&utm_medium=banner,,See all animals-themed-icons >,,,,
Database,"mysql, query, newsql, nosql",sql,,Done,Please integrate into plugin,Are you into big data?,https://www.ultimatelysocial.com/database-themed-icons/,https://www.ultimatelysocial.com/Database-themed-icons/?utm_source=any_settings_page&utm_campaign=Database_icons&utm_medium=banner,https://www.ultimatelysocial.com/Database-themed-icons/?utm_source=any_settings_page&utm_campaign=Database_icons&utm_medium=banner,,,,,
Flowers,"flower, flowering,orchid, floreal, roses, blossom, infloressence, effloressence, flowete","floret, florets, fiore, fiori,","floretta, fiorello, fiorella, fioretta, fioretto",Done,Please integrate into plugin,Do you like flowers?,https://www.ultimatelysocial.com/flower-themed-icons/,https://www.ultimatelysocial.com/Flowers-themed-icons/?utm_source=any_settings_page&utm_campaign=Flowers_icons&utm_medium=banner,https://www.ultimatelysocial.com/Flowers-themed-icons/?utm_source=any_settings_page&utm_campaign=Flowers_icons&utm_medium=banner,,,,,
Shoes,"sneaker, sneakers, moccassin, moccassins, sandal, sandals, footwear, footgear, footgears","shoe, shoes, slippers","horseshoe, horseshoes, slippery",Done,Please integrate into plugin,Do you like Shoes?,https://www.ultimatelysocial.com/shoes-themed-icons/,https://www.ultimatelysocial.com/Shoes-themed-icons/?utm_source=any_settings_page&utm_campaign=Shoes_icons&utm_medium=banner,https://www.ultimatelysocial.com/Shoes-themed-icons/?utm_source=any_settings_page&utm_campaign=Shoes_icons&utm_medium=banner,,,,,
Agriculture,"agriculture, agricultural, agrarian, agriturismo, agrario, agricoltore, agricoltore, agricolo, agricoli, farmboy, farmgirl, farmer, farmers, harvest, harvesting, farmhouse","farm, farms","farmacy, farmacia, farmacie. farmington, bakefarm, farmshop",Done,Please integrate into plugin,Is your site about agriculture / rural life?,https://www.ultimatelysocial.com/agriculture-themed-icons/,https://www.ultimatelysocial.com/Agriculture-themed-icons/?utm_source=any_settings_page&utm_campaign=Agriculture_icons&utm_medium=banner,https://www.ultimatelysocial.com/Agriculture-themed-icons/?utm_source=any_settings_page&utm_campaign=Agriculture_icons&utm_medium=banner,,,,,
Theatre,"theatre, theatres, broadway, dramaturgy, dramaturgies, theatrics. teatre, machaka, dance, dancing, dancer, teatre","opera, operas","operabrowser, operator, operators, operated",Done,Please integrate into plugin,Do you love Theatre?,https://www.ultimatelysocial.com/theatre-themed-icons/,https://www.ultimatelysocial.com/Theatre-themed-icons/?utm_source=any_settings_page&utm_campaign=Theatre_icons&utm_medium=banner,https://www.ultimatelysocial.com/Theatre-themed-icons/?utm_source=any_settings_page&utm_campaign=Theatre_icons&utm_medium=banner,,,,,
Beauty,"beauty, skincare, salon","spa, spas, nail, nails","newspaper, space, spaghetti, spasetti, thumbnail, thumbnails",Done,Please integrate into plugin,Your site is all about beauty?,https://www.ultimatelysocial.com/beauty-themed-icons/,https://www.ultimatelysocial.com/Beauty-themed-icons/?utm_source=any_settings_page&utm_campaign=Beauty_icons&utm_medium=banner,https://www.ultimatelysocial.com/Beauty-themed-icons/?utm_source=any_settings_page&utm_campaign=Beauty_icons&utm_medium=banner,,,,,
Holidays,"holiday, holidays, vaction, vacations, vacationer, hostel, hotel",,,Done,Please integrate into plugin,Is your site about vacations and holidays?,https://www.ultimatelysocial.com/holidays-themed-icons/,https://www.ultimatelysocial.com/Holidays-themed-icons/?utm_source=any_settings_page&utm_campaign=Holidays_icons&utm_medium=banner,https://www.ultimatelysocial.com/Holidays-themed-icons/?utm_source=any_settings_page&utm_campaign=Holidays_icons&utm_medium=banner,,,,,
Golf,"Golf, Golfer,",pga,,Done,Please integrate into plugin,Are you a golf fan?,https://www.ultimatelysocial.com/golf-themed-icons/,https://www.ultimatelysocial.com/Golf-themed-icons/?utm_source=any_settings_page&utm_campaign=Golf_icons&utm_medium=banner,https://www.ultimatelysocial.com/Golf-themed-icons/?utm_source=any_settings_page&utm_campaign=Golf_icons&utm_medium=banner,,,,,
Cricket,,Cricket,Crickets,Done,Please integrate into plugin,Are you a cricket fanatic?,https://www.ultimatelysocial.com/cricket-themed-icons/,https://www.ultimatelysocial.com/Cricket-themed-icons/?utm_source=any_settings_page&utm_campaign=Cricket_icons&utm_medium=banner,https://www.ultimatelysocial.com/Cricket-themed-icons/?utm_source=any_settings_page&utm_campaign=Cricket_icons&utm_medium=banner,,,,,
Motorsports,"rally, rallye, motoGP","Formula1, F1, Grand Prix, Fia",,Done,Please integrate into plugin,Are you into motorsports?,https://www.ultimatelysocial.com/motorsports-themed-icons/,https://www.ultimatelysocial.com/Motorsports-themed-icons/?utm_source=any_settings_page&utm_campaign=Motorsports_icons&utm_medium=banner,https://www.ultimatelysocial.com/Motorsports-themed-icons/?utm_source=any_settings_page&utm_campaign=Motorsports_icons&utm_medium=banner,,,,,
Baseball,"baseball, baseballs, homerun, homeruns",,,Done,Please integrate into plugin,Are you a baseball fanatic?,https://www.ultimatelysocial.com/baseball-themed-icons/,https://www.ultimatelysocial.com/Baseball-themed-icons/?utm_source=any_settings_page&utm_campaign=Baseball_icons&utm_medium=banner,https://www.ultimatelysocial.com/Baseball-themed-icons/?utm_source=any_settings_page&utm_campaign=Baseball_icons&utm_medium=banner,,,,,
Martial-Arts,"kungfu, karate, martialarts, martial-arts, mma, kickboxing, muaythai, muay-thai, kempo, martial-artist, martialartist, judo, jujitsu","mma, ufc",,Done,Please integrate into plugin,Are you into martial arts?,https://www.ultimatelysocial.com/martial-arts-themed-icons/,https://www.ultimatelysocial.com/Martial-Arts-themed-icons/?utm_source=any_settings_page&utm_campaign=Martial-Arts_icons&utm_medium=banner,https://www.ultimatelysocial.com/Martial-Arts-themed-icons/?utm_source=any_settings_page&utm_campaign=Martial-Arts_icons&utm_medium=banner,,,,,
Sky-Diving,"skydiving, skydiver, skydivers, sky-diving, sky-diver, sky-divers, parachute, parachuting",,,Done,Please integrate into plugin,Are you into sky diving?,https://www.ultimatelysocial.com/sky-diving-themed-icons/,https://www.ultimatelysocial.com/Sky-Diving-themed-icons/?utm_source=any_settings_page&utm_campaign=Sky-Diving_icons&utm_medium=banner,https://www.ultimatelysocial.com/Sky-Diving-themed-icons/?utm_source=any_settings_page&utm_campaign=Sky-Diving_icons&utm_medium=banner,,,,,
American-Football,"americanfootball, gridiron","NFL, NCAA",,Done,Please integrate into plugin,Are you an american football fan?,https://www.ultimatelysocial.com/american-football-themed-icons/,https://www.ultimatelysocial.com/American-Football-themed-icons/?utm_source=any_settings_page&utm_campaign=American-Football_icons&utm_medium=banner,https://www.ultimatelysocial.com/American-Football-themed-icons/?utm_source=any_settings_page&utm_campaign=American-Football_icons&utm_medium=banner,,,,,
Tennis,tennis,,,Done,Please integrate into plugin,Are you a tennis fan?,https://www.ultimatelysocial.com/snooker-themed-icons/,https://www.ultimatelysocial.com/Tennis-themed-icons/?utm_source=any_settings_page&utm_campaign=Tennis_icons&utm_medium=banner,https://www.ultimatelysocial.com/Tennis-themed-icons/?utm_source=any_settings_page&utm_campaign=Tennis_icons&utm_medium=banner,,,,,
Volleyball,"volley, volleyball, pallavolo",,,Done,Please integrate into plugin,Are you a volleyball fan?,https://www.ultimatelysocial.com/tennis-themed-icons/,https://www.ultimatelysocial.com/Volleyball-themed-icons/?utm_source=any_settings_page&utm_campaign=Volleyball_icons&utm_medium=banner,https://www.ultimatelysocial.com/Volleyball-themed-icons/?utm_source=any_settings_page&utm_campaign=Volleyball_icons&utm_medium=banner,,,,,
Snooker,"snooker, snooker",,,Done,Please integrate into plugin,Are you into snooker?,https://www.ultimatelysocial.com/volleyball-themed-icons/,https://www.ultimatelysocial.com/Snooker-themed-icons/?utm_source=any_settings_page&utm_campaign=Snooker_icons&utm_medium=banner,https://www.ultimatelysocial.com/Snooker-themed-icons/?utm_source=any_settings_page&utm_campaign=Snooker_icons&utm_medium=banner,,,,,
DIY,"do-it-yourself, doityourself, lifehack, lifehacker, lifehackers, mrfixit, mrfix-it","DIY, repair, repairing, repair",,Done,Please integrate into plugin,Your site is about DIY,https://www.ultimatelysocial.com/diy-themed-icons/,https://www.ultimatelysocial.com/DIY-themed-icons/?utm_source=any_settings_page&utm_campaign=DIY_icons&utm_medium=banner,https://www.ultimatelysocial.com/DIY-themed-icons/?utm_source=any_settings_page&utm_campaign=DIY_icons&utm_medium=banner,,,,,
Video,"Movie, Cinema, filmaker, filmakers","TV, Film, video, videos","montevideo, videogame, videogames",Done,Please integrate into plugin,Is your site about video entertainment?,https://www.ultimatelysocial.com/video-themed-icons/,https://www.ultimatelysocial.com/Video-themed-icons/?utm_source=any_settings_page&utm_campaign=Video_icons&utm_medium=banner,https://www.ultimatelysocial.com/Video-themed-icons/?utm_source=any_settings_page&utm_campaign=Video_icons&utm_medium=banner,,,,,
Law,"attorney, attorneys, lawyer, lawyers, tribunal, tribunals, abogado, adwokat","law, laws, judge, judges",,Done,Please integrate into plugin,Are you a lawyer?,https://www.ultimatelysocial.com/law-themed-icons/,https://www.ultimatelysocial.com/Law-themed-icons/?utm_source=any_settings_page&utm_campaign=Law_icons&utm_medium=banner,https://www.ultimatelysocial.com/Law-themed-icons/?utm_source=any_settings_page&utm_campaign=Law_icons&utm_medium=banner,,,,,
Occult,"paranormal, occult, occultism, illusionism, illusionist, parapsychology","ghost, ghosts, haunted, ",ghostscript,Done,Please integrate into plugin,Is your site about paranormal?,https://www.ultimatelysocial.com/occult-themed-icons/,https://www.ultimatelysocial.com/Occult-themed-icons/?utm_source=any_settings_page&utm_campaign=Occult_icons&utm_medium=banner,https://www.ultimatelysocial.com/Occult-themed-icons/?utm_source=any_settings_page&utm_campaign=Occult_icons&utm_medium=banner,,,,,
Toys,"LEGO, Playmobil, monopoly, boardgames, board-games","toys, toy, kid, kids","sextoy, sextoys",Done,Please integrate into plugin,Are you into toys?,https://www.ultimatelysocial.com/toys-themed-icons/,https://www.ultimatelysocial.com/Toys-themed-icons/?utm_source=any_settings_page&utm_campaign=Toys_icons&utm_medium=banner,https://www.ultimatelysocial.com/Toys-themed-icons/?utm_source=any_settings_page&utm_campaign=Toys_icons&utm_medium=banner,,,,,
